{
  "schemaVersion": "1.0",
  "certificationId": "2026-05-14-llm-driver-dogfood-delivery-certification",
  "workflowId": "top-skill-2-llm-dogfood",
  "deliveryStatus": "complete",
  "executionEvidence": {
    "executionIsolationLevel": "runner-enforced",
    "verificationEvidenceLevel": "hard-check-verified",
    "runnerName": "top-protocol-runner",
    "separateInvocationIds": [
      "resp_01329321917aff19006a06227e3f808192989d385e435dadfa",
      "resp_0d33b8fcfa578569006a062282a27c81929e8e348394f43d03"
    ],
    "schemaValidationCommand": "python scripts/top_protocol_runner.py <runner-workflow.json>",
    "hardCheckCommands": [
      "python -B scripts/quick_validate.py ."
    ],
    "limitations": [
      "Scaffolded runner workflow.",
      "LLM API adapter is configured; runner-enforced evidence requires successful API credentials and separate model invocations."
    ]
  },
  "judicialValidationRef": "reports/validation-report.json",
  "judicialHandoffRef": "handoffs/judicial.handoff.json",
  "validationReportRef": "reports/validation-report.json",
  "finalAuditReportRef": "reports/final-audit.md",
  "generationOrRepairPassIds": [
    "executive"
  ],
  "judicialPassId": "judicial",
  "separationOfPowersProof": [
    "Runner report records separate required pass invocation ids.",
    "Runner report records separate required pass context ids.",
    "Judicial handoff has validation authority and no edit/repair/certification authority.",
    "Required hard checks passed before certification."
  ],
  "requiredHardChecks": [
    {
      "id": "top-skill-quick-validate",
      "description": "Run top-skill package validation.",
      "requiredForComplete": true,
      "status": "pass",
      "command": "python -B scripts/quick_validate.py .",
      "evidence": [
        "quick_validate: OK\nvalidated: D:\\TOP\\top-skill\nhard_checks: 20\nagent_review_candidates: 0"
      ]
    }
  ],
  "blockingChecks": [
    {
      "checkId": "runner-evidence",
      "status": "pass",
      "evidence": [
        "runnerStatus=pass",
        "executionIsolationLevel=runner-enforced",
        "verificationEvidenceLevel=hard-check-verified"
      ]
    },
    {
      "checkId": "required-pass-status",
      "status": "pass",
      "evidence": [
        "executive:pass",
        "judicial:pass"
      ]
    },
    {
      "checkId": "adapter-invocation-evidence",
      "status": "pass",
      "evidence": [
        "executive:fresh=True,contextPackageOnly=True,modelEvidence=True",
        "judicial:fresh=True,contextPackageOnly=True,modelEvidence=True"
      ]
    },
    {
      "checkId": "separate-invocation-and-context-ids",
      "status": "pass",
      "evidence": [
        "invocationIds=2",
        "contextIds=2"
      ]
    },
    {
      "checkId": "required-hard-checks",
      "status": "pass",
      "evidence": [
        "top-skill-quick-validate:pass"
      ]
    },
    {
      "checkId": "independent-judicial-handoff",
      "status": "pass",
      "evidence": [
        "judicialPassId=judicial",
        "judicial handoff is independent from executive/repair authority"
      ]
    },
    {
      "checkId": "self-certification",
      "status": "pass",
      "evidence": [
        "No executive or repair handoff certified delivery."
      ]
    }
  ],
  "knownExclusions": [
    "Certification scope is this orchestration run package only; it is not a general top-skill release claim."
  ],
  "noBlockingInScopeViolations": true,
  "generationAndValidationSeparate": true,
  "noUnverifiedRequiredGates": true,
  "noRequiredGateFailedOrNotVerified": true
}
